Authors,Year,Title,doi,Sample Size,Population Characteristics,Technology Used,Stress Type,Measures,Study Design
"Hirten RP, Danieletto M, Tomalin L, Choi KH, Zweig M, Golden E, Kaur S, Helmus D, Biello A, Pyzik R, Calcagno C, Freeman R, Sands BE, Charney D, Bottinger EP, Murrough JW, Keefer L, Suarez-Farinas M, Nadkarni GN, Fayad ZA.",2021,Factors Associated With Longitudinal Psychological and Physiological Stress in Health Care Workers During the COVID-19 Pandemic: Observational Study Using Apple Watch Data,10.2196/31295,361,"Health care workers (HCWs) from 7 hospitals in New York City, NY. Mean age: 36.8 ± 10.1 years. Gender: 69.3% female (246 participants).","Wearable Device: Apple Watch (used to measure HRV longitudinally).
mHealth Application: Warrior Watch Study app (used for data collection).",Perceived longitudinal stress associated with the COVID-19 pandemic.,"Biomarkers: Heart rate variability (HRV).
Self-Report Tools: Surveys measuring perceived stress, resilience, emotional support, quality of life, and optimism.",Prospective observational digital study with longitudinal follow-up.
"Stasinaki A, Büchter D, Shih CI, Heldt K, Güsewell S, Brogle B, Farpour-Lambert N, Kowatsch T, l'Allemand D.",2021,"Effects of a novel mobile health intervention compared to a multi-component behaviour changing program on body mass index, physical capacities and stress parameters in adolescents with obesity: a randomized controlled trial",10.1186/s12887-021-02781-2,41,"Youth aged 10–18 years with BMI > P.90 with risk factors or co-morbidities, or BMI > P.97, all diagnosed with obesity (median BMI-SDS: 2.61).",mHealth Applications: PathMate2 app (daily conversational agent counseling and biofeedback relaxation exercises).,Acute stress (evaluated via plasma cortisol and stress questionnaires).,"Self-Report Tools: Stress questionnaires.
Other Measures: BMI-SDS, body fat, muscle mass (bioelectrical impedance analysis), waist-to-height ratio, physical capacities (modified Dordel-Koch-Test), blood pressure, and pulse.","Randomized controlled trial (RCT), not blinded."
"Boumparis N, Schulte MH, Kleiboer A, Huizink A, Riper H.",2021,A Mobile Intervention to Promote Low-Risk Drinking Habits in Young Adults: Protocol for a Randomized Controlled Trial,10.2196/29750,506,"Young adults aged 18-30 years, recruited from the Netherlands.","mHealth Applications: Boozebuster, a self-guided mobile app focused on developing and maintaining low-risk drinking habits.",Perceived stress (measured using the Perceived Stress Scale).,"Self-Report Tools: Perceived Stress Scale (PSS), Center for Epidemiological Studies Depression Scale, Rutgers Alcohol Problem Index, timeline follow-back (TLFB) for alcohol and cannabis consumption, Warwick-Edinburgh Mental Wellbeing Scale, Short-Form PTSD Checklist for DSM-5, Twente Engagement with eHealth Technologies Scale, Readiness to Change Questionnaire, Individual Work Performance Questionnaire.","Randomized Controlled Trial (RCT), two-arm, parallel-group design."
"Eagle DE, Rash JA, Tice L, Proeschold-Bell RJ.",2021,"Evaluation of a remote, internet-delivered version of the Trier Social Stress Test",10.1016/j.ijpsycho.2021.03.009,50,Mean age: 50.4 years (SD = 11.1). Gender: 56% male. Ethnicity: Primarily White (92%). Mean BMI: 29.5 (SD = 7.2). Mean leisure-time physical activity score: 37.3 (SD = 28.6).,"Wearable Device: Self-administered ECG monitors mailed to participants.
mHealth Application: Remote delivery of the Trier Social Stress Test via video conferencing.","Acute stress induced by the Trier Social Stress Test (iTSST), specifically using a speech and mental arithmetic task.","Biomarkers: Heart rate (HR). Root Mean Square of Successive Differences (RMSSD).
Self-report Tools: Perceived Stress (custom scale). Self-reported relaxation.",Mixed methods with a repeated measures design across two administrations of the iTSST.
"Bolliger L, Lukan J, Luštrek M, De Bacquer D, Clays E.",2020,"Protocol of the STRess at Work (STRAW) Project: How to Disentangle Day-to-Day Occupational Stress among Academics Based on EMA, Physiological Data, and Smartphone Sensor and Usage Data",10.3390/ijerph17238835,50,"Healthy adults with sedentary office-based jobs in academic settings. Participants used Android smartphones, worked at least 80% of the full-time workweek, and wore the Empatica wristband during waking hours.","Wearable Devices: Empatica E4 wristband, measuring heart rate variability (HRV), electrodermal activity (EDA), heart rate, skin temperature, and acceleration.
mHealth Application: Custom-developed STRAW app for ecological momentary assessment (EMA), smartphone sensor, and usage data collection.",Acute stress; day-to-day occupational stress.,"Biomarkers: Heart rate variability (HRV), electrodermal activity (EDA), blood pressure, heart rate, and skin temperature.
Self-Report Tools: Ecological Momentary Assessments (EMA) using Likert scales and binary response options.",Prospective observational study
"Khademian F, Aslani A, Ravangard R, Bastani P, Nami M, Jafari P.",2020,Efficacy of a web application for stress management among Iranian college students during COVID-19 outbreak: a study protocol for randomized controlled trials,10.1186/s13063-020-04949-0,100,"Iranian college students, aged 20–35 years, studying in BSc (second and higher semesters) or MSc programs at Shiraz University of Medical Sciences. Participants have smartphones, computers, laptops, or tablets, and no known psychological problems, psychiatric drug use, addictions, chronic physical diseases, or disabilities.","mHealth Application: ""Naranj,"" a web-based stress management app including stress management strategies (e.g., ACT-based techniques, 4-7-8 breathing, EFT, relaxing music, meditation, diary), COVID-19 education, and psychological consultation services.",Perceived stress.,Self-Report Tools: Perceived Stress Scale (PSS). Pittsburgh Sleep Quality Index (PSQI).,Randomized controlled trial (RCT)
"van Kraaij AWJ, Schiavone G, Lutin E, Claes S, Van Hoof C.",2020,Relationship Between Chronic Stress and Heart Rate Over Time Modulated by Gender in a Cohort of Office Workers: Cross-Sectional Study Using Wearable Technologies,10.2196/18253,328,Mean age: 38.9 years (SD: 10.2). Occupation: Healthy employees from technology companies.,"Wearable devices: Chest patch with an ECG sensor (256 Hz) and a wristband measuring skin conductance (256 Hz), skin temperature (1 Hz), and accelerometer (32 Hz).
mHealth application: Not explicitly mentioned. Stress assessment was conducted using physiological data and PSS scores.","Perceived chronic stress (measured using the Perceived Stress Scale, PSS).","Biomarkers: Heart Rate (HR) derived from ECG, with circadian and harmonic analyses (24, 12, 8, 6-hour periods).
Self-report tools: Perceived Stress Scale (PSS-10).",Observational study
"Gurel NZ, Jung H, Hersek S, Inan OT.",2019,Fusing Near-Infrared Spectroscopy with Wearable Hemodynamic Measurements Improves Classification of Mental Stress,10.1109/jsen.2018.2872651,16,adult,"Wearable Devices: Flexible headband with near-infrared spectroscopy (NIRS) for prefrontal cortex (PFC) oxygenation and forehead photoplethysmography for cardiovascular activity.
Additional Sensors: Electrocardiogram (ECG) and seismocardiogram (SCG).","Acute stress (indirectly inferred through rest, mental arithmetic, and N-back memory tasks).","Biomarkers: Cardiac and peripheral sympathetic activity, vasomotor tone, pulse wave propagation, and oxygenation.",Model development and validation study using machine learning
S. Aristizabal; K. Byun; N. Wood; A. F. Mullan; P. M. Porter; C. Campanella; A. Jamrozik; I. Z. Nenadic; B. A. Bauer,2021,The Feasibility of Wearable and Self-Report Stress Detection Measures in a Semi-Controlled Lab Environment,10.1109/ACCESS.2021.3097038,18,"Participants underwent the Trier Social Stress Test (TSST) in a controlled environment. Specific demographics (e.g., age, gender) were not provided.","Wearable Devices: Research-grade wearables measuring electrodermal activity (EDA), skin temperature, and heart rate.
mHealth Applications: Self-reported stress and anxiety ratings via surveys.","Acute stress, perceived stress, and anxiety induced by TSST (anticipation, mental arithmetic, and speech tasks).","Biomarkers: Heart rate (HR), electrodermal activity (EDA), skin temperature, and salivary cortisol.
Self-Report Tools: ""In the moment"" stress scale and State-Trait Anxiety Inventory (STAI).",Experimental study utilizing the TSST protocol and deep learning models for stress detection.
U. Pluntke; S. Gerke; A. Sridhar; J. Weiss; B. Michel,2019,Evaluation and Classification of Physical and Psychological Stress in Firefighters using Heart Rate Variability,10.1109/EMBC.2019.8856596,26,"Participants included both males and females aged 23 to 59. Fitness levels ranged from very fit to below average, with smokers also included. The firefighters in the field study were generally older than the lab participants.","Wearable Device: Polar H7 chest strap sensor for RR interval detection.
mHealth Application: EliteHRV app for data collection and real-time visualization.","Physical stress (e.g., treadmill, cycling, or ladder exercises). Mental stress (e.g., IQ tests, Stroop-Color-Word tests, arithmetic tests). Combined physical and mental stress (e.g., treadmill running while solving arithmetic problems).","Biomarkers: Heart rate variability (HRV) parameters, including time-domain (SDNN, pNN50) and frequency-domain metrics (LF/HF).",Controlled Lab Study